SELECT EnableLongTransactions();
      enablelongtransactions       
-----------------------------------
 Long transactions support enabled
(1 row)

CREATE TABLE test_locks (id numeric, state varchar);
select sn_create_distributed_table('test_locks', 'id', 'none');
 sn_create_distributed_table 
-----------------------------
 
(1 row)

INSERT INTO test_locks(id) VALUES (1);
INSERT INTO test_locks(id) VALUES (2);
INSERT INTO test_locks(id) VALUES (3);
-- Enable locks checking on the table
SELECT CheckAuth('test_locks', 'id');
 checkauth 
-----------
         0
(1 row)

-- this has no lock
UPDATE test_locks SET state = 'nolocks';
-- place the lock
SELECT LockRow('test_locks', '1', 'auth1', now()::timestamp+'00:01');
 lockrow 
---------
       1
(1 row)

SELECT LockRow('test_locks', '2', 'auth2', now()::timestamp+'00:01');
 lockrow 
---------
       1
(1 row)

-- this should fail due to missing auth
UPDATE test_locks SET state = 'unauthorized' where id = 1;
BEGIN;
	-- Add authorization for row 1
	SELECT AddAuth('auth1');
 addauth 
---------
 t
(1 row)

	-- we're authorized for row 1
	UPDATE test_locks SET state = 'authorized' where id = 1;
END;
-- Out of transaction we're no more authorized for row 1
UPDATE test_locks SET state = 'unauthorized' where id = 1;
BEGIN;
	-- Add authorization for row 2
	SELECT AddAuth('auth2');
 addauth 
---------
 t
(1 row)

	-- we're authorized for row 2
	UPDATE test_locks SET state = 'authorized' where id = 2;
END;
BEGIN;
	-- Add authorization for row 2
	SELECT AddAuth('auth2');
 addauth 
---------
 t
(1 row)

	-- we're *not* authorized for row 1
	UPDATE test_locks SET state = 'unauthorized' where id = 1;
END;
UPDATE test_locks SET state = 'unauthorized' where id = 2;
UPDATE test_locks SET state = 'unauthorized' where id = 1;
SELECT * from test_locks;
 id |    state     
----+--------------
  2 | unauthorized
  3 | nolocks
  1 | unauthorized
(3 rows)

DROP TABLE test_locks;
SELECT DisableLongTransactions();
      disablelongtransactions       
------------------------------------
 Long transactions support disabled
(1 row)

